{
  "schema": "awf.risk-gate.v1",
  "run_id": "20260528-claudekit-integration",
  "risk": "LOW",
  "decision": "ALLOW",
  "blast_radius": {
    "gitnexus": "GitNexus repo ai-forge available; checklist.py symbols were not indexed, so impact returned UNKNOWN for main/run_check. Runtime blast radius is the checklist CLI and npm audit script.",
    "direct_callers": 0,
    "affected_processes": []
  },
  "blockers": [],
  "approval_required": false
}
